{
  "protocol_id": "01",
  "protocol_title": "PROTOCOL 00A: CLIENT PROPOSAL GENERATION (DISCOVERY COMPLIANT)",
  "generated_at": "2025-10-19T03:43:54.787667Z",
  "automation_coverage": {
    "referenced_scripts": [],
    "missing_scripts": [],
    "coverage": 1.0
  },
  "artifacts": [
    {
      "path": ".artifacts/protocol-01/jobpost-analysis.json",
      "status": "pending",
      "description": "Parsed job post objectives, tone, and risks"
    },
    {
      "path": ".artifacts/protocol-01/tone-map.json",
      "status": "pending",
      "description": "Tone classification and strategy mapping"
    },
    {
      "path": ".artifacts/protocol-01/PROPOSAL.md",
      "status": "pending",
      "description": "Client-facing proposal document"
    },
    {
      "path": ".artifacts/protocol-01/humanization-log.json",
      "status": "pending",
      "description": "Humanization filter application log"
    },
    {
      "path": ".artifacts/protocol-01/proposal-validation-report.json",
      "status": "pending",
      "description": "Final validation evidence"
    },
    {
      "path": ".artifacts/protocol-01/compliance-validation-report.json",
      "status": "pending",
      "description": "Compliance check results"
    }
  ],
  "validators": [
    {
      "name": "gate_1_job_post_intake",
      "command": "python3 scripts/validate_gate_01_jobpost.py",
      "status": "pass",
      "notes": "{\n  \"status\": \"pass\",\n  \"score\": 1.0,\n  \"notes\": \"Job post analysis complete with score 1.00\"\n}"
    },
    {
      "name": "gate_2_tone_strategy",
      "command": "python3 scripts/validate_gate_01_tone.py",
      "status": "pass",
      "notes": "{\n  \"status\": \"pass\",\n  \"confidence\": 0.85,\n  \"strategy\": \"technical-professional\",\n  \"notes\": \"Tone classification confidence 0.85 with strategy 'technical-professional'\"\n}"
    },
    {
      "name": "gate_3_proposal_structure",
      "command": "python3 scripts/validate_gate_01_structure.py",
      "status": "fail",
      "notes": "{\n  \"status\": \"fail\",\n  \"score\": 0.8571428571428571,\n  \"notes\": \"Section 'greeting' has only 9 words (< 120); Section 'understanding' has only 13 words (< 120); Section 'proposed approach' has only 13 words (< 120); Section 'deliverables' has only 17 words (< 120); Missing section: 'timeline'; Section 'collaboration' has only 12 words (< 120); Section 'next steps' has only 12 words (< 120)\"\n}"
    },
    {
      "name": "gate_4_compliance",
      "command": "python3 scripts/validate_gate_01_compliance.py",
      "status": "fail",
      "notes": "{\n  \"status\": \"fail\",\n  \"checks_run\": 3,\n  \"notes\": \"check_hipaa.py: PASS; enforce_gates.py: FAIL - [GATES] coverage artifact not found (coverage-summary.json or coverage.xml)\\n; validate_compliance_assets.py: FAIL - \"\n}"
    },
    {
      "name": "gate_5_final_validation",
      "command": "python3 scripts/validate_gate_01_final.py",
      "status": "pass",
      "notes": "{\n  \"status\": \"pass\",\n  \"readability\": 92,\n  \"empathy_coverage\": 5,\n  \"notes\": \"All final validation checks passed\"\n}"
    }
  ],
  "notes": "Gate automation for client proposal generation workflow.\nEnsures job post analysis, tone mapping, proposal structure, compliance, and final validation.\n"
}